query_id	query	item_type	var_desc	var_narr
33371	selbstverwirklichung	variables	The user wants to assess how important self-fulfillment/self-actualization (selbstverwirklichung) is to a person when considering their life goals, using a 1–7 importance scale. They need clear instructions or a concise definition so respondents can reliably rate the personal importance of self-realization.	A document is relevant to the keyword "selbstverwirklichung" if it explicitly addresses self-realization or closely related ideas such as personal goals, life aspirations, value priorities, or measures of psychological growth. The supplied paragraph is relevant because it directly asks respondents to reflect on "what you actually strive for in your life" and to rate the importance of those items on a 1–7 scale, which is a survey approach to assessing self-fulfillment. Other clearly relevant examples include psychological discussions (e.g., Maslow’s self-actualization), interviews or personal essays about achieving one’s potential, and validated scales or survey items that operationalize self-realization. Non-relevant documents are those that only mention the term in passing, use it as a brand or headline unrelated to meaning, or cover unrelated topics (technical manuals, recipes, legal notices); boilerplate survey templates that never list substantive life-goals are borderline relevant but less useful than items that actually probe specific aspirations. Edge cases include translations or metaphorical uses where the term appears but the content does not explore personal striving, which should be judged less relevant unless context shows a thematic focus on self-realization.
34932	rightwing	variables	The user wants a concise paragraph defining "rightwing" — a political label for conservative or reactionary positions that typically favor limited government, free-market economics, traditional social and cultural values, strong national defense, and law-and-order policies. They likely expect a clear summary of core beliefs and how right-wing views contrast with left-wing positions.	A document is relevant to the keyword "rightwing" if its primary focus is on right-wing politics or ideology—discussing conservative, nationalist, libertarian, or far‑right movements, party platforms, typical policy positions (e.g., immigration restriction, free‑market advocacy), historical development, or profiles of right‑wing leaders and organizations. Useful examples include analyses of a country's right‑wing party, academic papers comparing right‑wing policy trends, news reports about right‑wing rallies, or datasets showing voting patterns among right‑wing constituencies. Non‑relevant documents treat the term in a different sense (e.g., describing the right wing of a building or aircraft), use it only in passing without substantive content, are spam, or contain unrelated homographs or usernames that happen to include the word. Edge cases include phrases like "the right wing of the party" (which may be relevant if it discusses intra‑party ideology), differences in what counts as right‑wing across countries, and pieces that merely quote right‑wing rhetoric without analysis—these can be borderline relevant depending on depth and intent.
39506	sozialisation	variables	A request to report, on a given scale, how much religious education influenced one’s upbringing in the parental home — i.e., to quantify the role of religious socialization by the family. This information is needed to assess the strength of familial socialization in shaping religious values and practices.	A document is relevant to the keyword "sozialisation" if it explicitly addresses processes of socialization—especially family-centered topics such as how parental upbringing and religious education shaped a person—like the survey prompt "Bitte sagen Sie mir anhand dieser Skala jetzt welche Rolle in Ihrem Elternhaus die religiöse Erziehung gespielt hat." Relevant examples include questionnaire items, interview transcripts about parental influence, sociological studies of religious socialization, and codebooks reporting Likert-scale answers. Non-relevant documents include uses of similar words in other senses (e.g., workplace onboarding, animal socialization), pages that only contain the keyword without substantive content, or completely unrelated topics such as product descriptions or news articles. Edge cases include texts that mention "religiöse Erziehung" but treat it theologically rather than as a socialization process, translations or survey templates that include the phrase but lack empirical data, and documents with HTML artifacts (like "br" or "Answer:") that signal a scraped or partially formatted questionnaire—these may be partially relevant depending on whether they preserve the socialization context.
4027	migrationshintergrund	variables	The user wants a clear definition and explanation of the German term "Migrationshintergrund" — who is counted as having a migration background, how the term is used in official statistics, forms, and law, and what social or administrative implications it carries. They may also be seeking criteria, examples, or guidance on how to report this status on documents.	A document is relevant to the keyword "migrationshintergrund" if it treats that term as the demographic or legal concept used in German-speaking contexts — for example studies, reports or policies that analyze people "mit Migrationshintergrund" or provide census and school statistics by migration background. Relevant examples include government or NGO reports on integration, academic articles about educational outcomes by migration background, public-health research stratified by Migrationshintergrund, and policy briefs on anti-discrimination measures. Documents are non-relevant when the word appears only incidentally or in an unrelated sense, such as software/database migration logs, travelogues, genealogical migration histories, or when it is merely part of a filename or metadata with no substantive discussion. Edge cases include texts in other languages that discuss the same concept (those are relevant if they clearly map to the German category), short tables that list counts without explanation (borderline relevance), and personal anecdotes about individual immigrants (relevant only if they connect to the broader category or analysis).
43698	covid19	variables	A user querying "covid19" is seeking basic and up-to-date information about the disease caused by SARS-CoV-2—its symptoms, transmission, testing, treatment, vaccines, and prevention measures. They may also want current case trends, variant information, and relevant public‑health or travel guidance.	A document is relevant to the keyword "covid19" if it directly addresses SARS‑CoV‑2 or the COVID‑19 pandemic — for example discussions of symptoms, transmission, testing, vaccines, treatments, public‑health guidance, case counts, or variant surveillance. Highly relevant examples include CDC or WHO guidance, peer‑reviewed studies on vaccine efficacy, official local restriction updates, and datasets of confirmed cases; by contrast, social media rumors, opinion pieces without evidence, or documents that merely mention COVID‑19 in passing are less relevant. Non‑relevant documents include unrelated materials that include the string "covid19" in a filename, references, or metadata but whose main topic is different, or content about other respiratory diseases without clear connection to SARS‑CoV‑2. Edge cases depend on user intent and timeliness: early‑pandemic guidance may be historically relevant but clinically outdated, and modeling or preprint studies may be important for research queries yet unsuitable for medical advice. Finally, relevance also depends on synonyms and language (e.g., "coronavirus," "SARS‑CoV‑2") and source credibility — authoritative, recent sources should be prioritized for health or policy queries.
5030	sicherheitsgefühl	variables	A search for "sicherheitsgefühl" seeks a clear explanation of the subjective sense of safety—what it means, how it differs from objective risk, and the personal, social, and environmental factors that shape it. The user may also want ways to measure or strengthen that feeling and to understand its effects on behaviour and well‑being.	A document is relevant to the keyword "sicherheitsgefühl" when it explicitly discusses the subjective feeling or perception of safety—for example studies, interviews, surveys, or policy analyses about how people feel in their homes, neighborhoods, workplaces, or on public transport. Relevant material can include research on psychological factors, environmental design (lighting, visibility, urban planning), community measures (neighbourhood watches, policing strategies) or evaluations of interventions that aim to improve perceived safety. Documents that only report objective crime statistics without linking them to residents' perceptions, or that treat "Sicherheit" solely as technical or legal security (e.g., cybersecurity protocols or safety regulations) are generally not relevant unless they address the emotional or perceptual dimension. Edge cases include articles about physical security measures (CCTV, locks) which are relevant if they explore their impact on people’s sense of security, and translated or synonym-using texts (e.g., "sense of safety") which are relevant if the connection to subjective perception is clear. Non-relevant items can also be brand names, product pages, or incidental mentions where the term appears but the document does not examine feelings of safety.
50581	digitalisierung	variables	The user wants a concise paragraph that defines "Digitalisierung" (digitalization) and summarizes its significance, main effects, and typical applications (e.g., in business, public services, and daily life). They likely need a clear, ready-to-use text for an essay, report, or presentation.	A document is relevant to the keyword "digitalisierung" if it directly addresses digitalization as a process—covering strategies, technologies, policy, case studies, implementation steps, or measurable outcomes (for example, papers on e‑government rollout, Industry 4.0 adoption, cloud migrations, or workforce digital‑skill programs). Relevant texts typically use related terminology (IoT, AI, digital transformation, digitization strategy), give concrete examples or metrics, and explain challenges and solutions. Non‑relevant documents merely mention the word in passing, use it in an unrelated sense (e.g., simple file scanning labeled “digitization”), are generic marketing spam, or focus on tangential topics without substantive discussion. Edge cases include language/term differences (German "Digitalisierung" vs English "digitization"), sector‑specific reports that may be relevant only to particular industries, and older sources whose guidance may be outdated; a brief mention or a translated hit may be useful depending on user intent but often isn’t sufficient. Signals of high relevance are in‑depth coverage, clear methods or case studies, up‑to‑date dates, and matching language/region.
5065	sicherheitsempfinden	variables	The user wants to describe or assess their personal sense of safety ("Sicherheitsempfinden") in public places—whether they generally feel safe or unsafe. They may also be seeking to identify circumstances or factors (time, location, crowding, lighting, etc.) that influence that feeling.	A document is relevant if it focuses on people's subjective sense of safety in public places, for example survey questions or interview responses asking “Do you generally feel safe at public places?” or analyses of how perceptions vary by time of day, lighting, crowding, police presence, gender or age. Useful documents will describe measurement methods (Likert-scale questions, open-ended personal accounts, neighborhood safety indexes) or give concrete examples like “I don’t feel safe in poorly lit parks at night.” Non-relevant documents discuss unrelated kinds of security (cybersecurity, physical locks, workplace health-and-safety rules) or only present raw crime statistics without linking them to perceived safety. Edge cases include materials that use only the word “Sicherheit” (safety) without addressing “empfinden” (feeling) — these may be partially relevant if they discuss public safety conditions — and short or truncated German phrases; texts in German that mirror the question are especially pertinent, while translations and broader mental-health discussions are relevant only when tied to feeling safe in public spaces.
52781	alkoholkonsum	variables	The user is looking for survey question wording and response categories to measure alcohol consumption frequency (e.g., past 12 months and past month), including typical answer ranges like "never", numeric frequency bands (1–5, 6–11, etc.), weekly/monthly/daily categories, and associated skip/branching instructions.	A document is relevant to the keyword "alkoholkonsum" if it contains questionnaire items or response categories that measure alcohol consumption frequency or recency (e.g., “How often have you drunk alcohol in the last year/month/last 12 months”), including the specific response scales (Never; 1–5 times; approximately once a month; 1–2 times, 3–5 times, …, more than 20 times). Concrete indicators of relevance include survey instructions and skip logic tied to consumption codes (for example “if code 13 continue with 55” or “if yes to monthly code 4 continue with 13b”), labels like FW2/F13/F62, and atypical response options such as “yes but only one gulp.” Partial matches (frequency mentioned without a clear timeframe, or general references to drinking behavior) are somewhat relevant but weaker, while documents that discuss alcohol-related diagnoses, policy, or biomarkers without frequency questions are only tangentially relevant. Non-relevant documents are those focusing on other substances, unrelated health topics, or purely administrative text with no consumption items. Edge cases to watch for include linguistic variations (“consumed,” “had a drink,” German phrasing), duplicate or slightly different scales across forms, and very low-frequency categories that may be coded differently across surveys.
53827	berufsabschluss	variables	The user needs to understand or answer whether they hold a "Berufsabschluss" — i.e., a completed vocational training qualification or an academic degree — typically to complete a form or verify eligibility for a job, benefit, or application.	A document is highly relevant to the keyword "berufsabschluss" if it explicitly asks about or describes a completed vocational qualification or academic degree — for example a job application form, CV, certificate recognition form, or guidance on proving a completed apprenticeship or study program. The repeated question "Haben Sie eine abgeschlossene Berufsausbildung oder ein abgeschlossenes Studium" in the paragraph is a direct match and signals a questionnaire or form field, so such a document would be judged very relevant. Borderline or partial relevance occurs when synonyms or variants are used (Ausbildung, Abschluss, Qualifikation) or when the text discusses having no Berufsabschluss ("ohne Berufsabschluss"); these are still pertinent but may require stemming or semantic matching. Non-relevant documents mention similar words in different senses (e.g., a general "Abschluss" meaning a thesis defense, content about ending a career, or OCR/misspellings like "berufsabsschluss") or only contain the term incidentally without substantive information about vocational credentials.
54808	berufsprestige	variables	The user wants a concise definition and explanation of "Berufsprestige" (occupational prestige), including how professions are ranked and which factors (income, education, social respect, measurement methods like surveys or prestige scales) determine those rankings. They may also be looking for example rankings or the term's relevance in sociology and labor research.	A document is relevant to the keyword "berufsprestige" if it contains a paragraph that defines or discusses occupational prestige, explains how it is measured (for example SIOPS, Treiman’s scale, or survey-based rankings), or gives concrete examples or lists of professions ranked by social status. Relevant documents will also analyze causes and consequences of berufsprestige—such as education, income, or cultural values—or present empirical results from surveys or cross‑country comparisons. Non‑relevant documents merely mentioning the word in passing, using "prestige" in a non‑occupational sense (brand prestige, product names), or containing only metadata, isolated tables, or code without explanatory text should be excluded. Edge cases include multilingual works where "berufsprestige" appears only in a bibliography or a translated term in an otherwise English discussion (potentially useful), and historical or marketing uses that resemble the concept but do not address its sociological meaning (likely not useful). In a German query context, German‑language paragraphs are preferable, but rigorous English analyses explicitly about occupational prestige are also relevant.
55226	arbeitsbelastung	variables	The user is looking for a short paragraph about "Arbeitsbelastung" (workload/occupational stress). They likely want a concise explanation defining the term and summarizing common causes, effects, and/or strategies to manage it, suitable for a report or assignment.	A document is relevant to the keyword "arbeitsbelastung" when it addresses workload or occupational strain directly—discussing causes, measurements, health effects, legal duties, or interventions for work-related stress (for example a study measuring nurses’ workload, a company risk assessment, or guidance under Arbeitsschutzgesetz). Highly relevant texts include empirical papers with measurements or questionnaires (COPSOQ, surveys, physiological metrics), workplace case studies, occupational health guidance, or legal/regulatory discussions that explicitly use the term or close synonyms like "Belastung am Arbeitsplatz" or "Überlastung." Non-relevant documents merely containing the word once in passing, advertising copy that mentions workload without substantive content, or papers using "Arbeit" in the physics sense (work/energy) or discussing CPU/server load are not relevant to human occupational workload. Edge cases arise when the domain is ambiguous (IT/system "workload" vs. human "Arbeitsbelastung"), when only translations or metadata include the term, or when related topics such as "Arbeitszeit" or general stress are discussed without linking to work-specific burden—these require checking context to decide relevance. Practical signals of strong relevance are explicit populations, methods, outcomes, statistics, or intervention descriptions; weak signals are single-word occurrences, unrelated domains, or mere bibliographic mentions.
56202	arbeitsbelastungen	variables	Looking for information on "arbeitsbelastungen" (workload/occupational strain): what types and causes exist, how they affect physical and mental health, and how to assess and manage or reduce them in the workplace.	A document is relevant to the keyword "arbeitsbelastungen" if it directly addresses workplace burdens or workloads—describing types (physical, mental, emotional), causes (long hours, understaffing, high tempo, role conflict), measurements (surveys, questionnaires, COPSOQ), consequences (stress, burnout, absenteeism) or mitigation strategies (ergonomics, job redesign, legal protections). Relevant examples include German-language occupational health reports, company risk assessments mentioning "Arbeitsbelastungen," research papers comparing workload across professions, or guides for works councils on reducing job strain. A document is non-relevant if the term appears only in passing, is used in a different sense (e.g., structural engineering loads, financial burdens unrelated to work), or if it treats unrelated populations without workplace context (e.g., student homework load only). Edge cases include materials about unpaid care work or home-office stress—these can be relevant if framed as "work" or occupational burden—and translations or singular/plural variants ("Arbeitsbelastung"/"arbeitsbelastungen") should be treated as matching the same topic.
5736	wohlfahrtsstaat	variables	The user is seeking to measure attitudes toward the welfare state in Germany by presenting a list of statements about social inequalities and the role of state and economy; for each statement they want respondents to indicate one of four agreement levels (fully agree, rather agree, rather disagree, or completely disagree).	A document is relevant to the keyword "wohlfahrtsstaat" when it directly discusses the welfare state, social inequality, or the role of the state in providing social protection — for example policy analyses, descriptions of social transfers, or surveys of public attitudes toward social spending. The provided paragraph repeatedly asks respondents about "Staat und Wirtschaft" and "soziale Unterschiede," so it is relevant insofar as it gathers opinions tied to welfare‑state issues, but it contains little substantive analysis or concrete policy content. A non‑relevant document would only mention the word in passing, be unrelated (e.g., technical manuals, ads), or consist mainly of boilerplate repetition and spam that add no topical information. Edge cases include texts that treat "wohlfahrtsstaat" historically or comparatively (partially relevant) or questionnaires and survey prompts like this one (relevant for public opinion research but lower value for policy detail). Overall, this paragraph is topically on‑target but of limited usefulness without the actual statements or responses.
60378	führungsstil	variables	The searcher wants a clear explanation of "Führungsstil" (leadership style), including its definition and common types with their key characteristics and effects on teams. They may also be seeking practical guidance on how to identify, compare, or develop an effective leadership style for a given context.	A document is relevant to the keyword "führungsstil" when it directly discusses leadership styles—definitions, typologies (e.g., authoritarian, democratic, laissez-faire, transformational), measurement tools, effects on team performance, or case studies in management contexts. For example, a German study comparing transformational and transactional Führungsstil in Mittelstand firms or a training manual describing how to adopt a participative Führungsstil would be highly relevant. Documents are non-relevant if they only mention the word in passing, use it as a metadata tag with no substantive content, or cover unrelated topics that happen to contain similar text (e.g., "Führerschein" or stylistic design guides). Edge cases include domain-specific treatments (military, nursing, software teams) that are relevant but narrow in scope, translations or documents in English that use "leadership style" instead of the German word, and OCR/typo variants like "fuhrungsstil"—these may be relevant but require normalization or user-intent clarification. Lastly, opportunistic content such as marketing blurbs or personality-quiz pages that superficially reference Führungsstil may be less useful for research despite matching the keyword.
6213	religionszugehörigkeit	variables	The user is looking for standard survey wording and response categories for "religionszugehörigkeit" (religious affiliation), e.g., options like Catholic, Evangelical/Protestant, other, and none, often reported as percentages of the population. The underlying goal is to collect comparable data on respondents' religious denomination for analysis or presentation.	A document is relevant to the query "religionszugehörigkeit" if it discusses religious affiliation directly — for example survey items, census tables, or questionnaires that list response categories like Catholic, Evangelical/Protestant, Other, or None, or that report percentages of the population by religion. Items such as interview instructions, codebooks with numeric response options (1 = Catholic, 2 = Evangelical, 3 = Other, 4 = None), or questions about preferring to live in a predominantly Catholic or Protestant village are clearly relevant because they capture denominational belonging. Documents that are not relevant include theological essays, descriptions of religious rituals, institutional histories, or organizational mission statements that do not address individual affiliation or demographic coding. Borderline cases include texts that mention "religion" only as an explanatory factor (e.g., church tax laws) or that discuss belief/practice rather than formal affiliation — these can be partially relevant depending on whether they treat membership categories (Konfession, Religionsgemeinschaft) or only attitudes. Also consider language and form variations: German synonyms (Konfession, Religionsgemeinschaft) and translated questionnaires or scanned forms are relevant, though scanned images may require OCR to extract the affiliation data.
