query_id	query	item_type	var_desc	var_narr
6346	worklifebalance	variables	The user wants to know which policy or workplace measures would be most effective in helping Europeans reconcile private and working lives—given that about 45% of the labour market are women. They are seeking a recommendation or ranking of options (e.g., flexible hours, parental leave, affordable childcare, telework) that best support work–life balance.	A document is relevant to the query "worklifebalance" if it directly discusses measures that help people reconcile private and working lives in a European context — for example policies on parental leave, affordable childcare, flexible working hours, teleworking, care services, and gender-equal labour market measures — and backs claims with data or evaluations. Policy briefs, EU survey results, comparative country case studies, and program evaluations (e.g., showing how paid parental leave increased women's labour force participation from X% to Y%) are clear examples of relevant sources. Documents that are not relevant include those that only use the phrase superficially, discuss unrelated kinds of "balance" (financial balance sheets, fitness advice), or describe corporate perks without linking them to measurable reconciliation outcomes. Edge cases include pieces that cite the statistic in the paragraph (e.g., "45% of people in the labour market are women") but offer no policy analysis, outdated or non‑EU data that may not generalize, or materials focused on a single niche group (such as managers only) where conclusions won’t apply broadly.
6501	homosexualität	variables	The user wants information about homosexuality in professional football, specifically how active players who come out are perceived and whether they would receive acceptance and support from teammates, fans, and institutions. They are asking about current attitudes, prevalence of openly gay active players, and examples or evidence of support or discrimination.	A document is relevant to the keyword "homosexualität" if it directly treats homosexuality as its subject—e.g., news reports or interviews about Thomas Hitzlsperger coming out, pieces on whether active professional footballers can or do come out, public reaction, anti-discrimination policies, or social-science research on attitudes toward gay athletes. Concrete examples of relevant documents include a German-language press article quoting Hitzlsperger, an interview with an active player about coming out, or an opinion piece on acceptance in football. Non-relevant documents merely containing the word in passing (for example a match report that briefly mentions a player's sexual orientation without discussion), using a different meaning, or unrelated pages (spam, unrelated biographies) should be excluded. Edge cases include content about homosexual behavior in animals or legal definitions of homosexuality—which may be tangentially relevant depending on user intent—as well as ambiguous mentions, translation errors, or private-person speculation that raise privacy and sensitivity concerns.
6534	kriminalitätsfurcht	variables	The user wants to know whether there are any areas — especially within about one kilometer or elsewhere in their town/municipality — that people consider unsafe to walk alone at night. This information measures personal fear of crime and the perceived spatial distribution of neighbourhood safety.	A document is relevant to the keyword "kriminalitätsfurcht" (fear of crime) if it addresses people's perceptions of safety—especially references to not wanting to walk alone at night, descriptions of specific local areas or neighborhoods within a short distance (e.g., within one kilometer), survey questions or interview transcripts asking about such avoidance, or first‑hand reports like “I avoid the park after dark.” The repeated paragraph here clearly contains a survey/interview prompt about local night‑time avoidance, so any document containing that text would be highly relevant as it directly measures fear of crime in the immediate vicinity. Documents that only give raw crime statistics, legal definitions, or policy descriptions without linking them to residents’ perceived safety are generally non‑relevant, because they do not capture the subjective fear the query targets. Borderline cases include materials about crime prevention or policing that imply changes in fear (relevant if they report residents’ reactions) and noisy transcripts or repeated lines (like this paragraph) which are still relevant if they reflect the original survey wording or respondent answers.
6763	psychotherapie	variables	The user wants a clear, concise explanation of psychotherapy—what it is, how it works, and when it’s used—plus basic information about common approaches (e.g., CBT, psychodynamic), expected outcomes, and how to find or access a therapist.	A document is relevant to the keyword "psychotherapie" if its main topic is psychotherapy—definitions, treatment methods (CBT, psychodynamic, humanistic, etc.), clinical evidence, indications, provider qualifications, access and insurance issues, or practical guidance for patients and clinicians. Highly relevant examples include clinical guidelines on psychotherapy for depression, research studies on therapeutic effectiveness, directories of licensed psychotherapists, and patient information pages explaining what psychotherapy entails. Non-relevant documents mention the word only peripherally (e.g., a news article that fleetingly references psychotherapy), focus on unrelated "therapy" topics (physical therapy, machine learning "therapy" metaphors), or use the term in a purely bibliographic list with no substantive content. Edge cases include pages about psychotherapy training, regulation, or accreditation (potentially relevant depending on intent), documents in other languages that nevertheless use the exact term "psychotherapie" (more relevant than generic translations), and compound or specialized terms (e.g., "Kunsttherapie" or "Psychotherapieforschung") which may be partially relevant depending on whether the user seeks general psychotherapy information or a specific subtopic.
7939	psychologie	variables	The user is looking for a concise overview of "psychology" — what it studies (mind and behavior), its major subfields (e.g., clinical, cognitive, developmental, social), common research methods, and practical applications such as therapy, assessment, and career paths.	A document is relevant to the keyword "psychologie" if its main content directly discusses psychology topics — for example papers on cognitive processes, clinical therapy methods, developmental stages, psychological research findings, or program descriptions for a "psychologie" degree. Relevance is stronger when the term appears in headings, abstracts, or detailed sections rather than just a passing mention; an academic article about cognitive biases or a mental-health blog post that explains therapy techniques are clearly relevant. Non-relevant documents merely containing the word (e.g., a company name, an unrelated news story that quotes "psychologie" once, or an SEO page repeating the term without substantive content) should be excluded. Edge cases include multilingual pages where "psychologie" appears but most content is in another language, interdisciplinary works (e.g., social neuroscience) that partially focus on psychology, and course listings that name "psychologie" but provide no description — these can be borderline and require judging whether the psychological content is substantive.
810	bildungsgrad	variables	The searcher wants a clear definition of the German term "Bildungsgrad" — the level or degree of formal education someone has attained. They likely seek how it’s classified or measured (e.g., school leaving certificates, vocational training, university degrees) for surveys, statistics, or personal profiles.	A document is relevant to the keyword "bildungsgrad" if it explicitly addresses educational attainment or "education level" — for example census tables, survey reports, academic papers, or datasets that define and report categories such as "no formal education", "primary", "secondary", or "tertiary." Relevant items will explain how the bildungsgrad is measured (question wording, age cutoffs, ISCED mapping), give breakdowns by demographics (age, region, income), or use the term in a German-language policy or research context. Non-relevant documents merely mentioning the word in passing, using "degree" in a non-educational sense (e.g., mathematical degree or temperature degree), or focusing on unrelated aspects of "Bildung" without classifying levels would not be useful. Edge cases include English-language sources that never use the German term but fully cover "education level" (these are relevant), and historical texts that use obsolete educational categories or inconsistent mappings — they may be relevant but require careful interpretation.
828	nachhaltigkeit	variables	A user searching "Nachhaltigkeit" is likely looking for a clear definition and overview of sustainability, including its environmental, social, and economic dimensions. They may also want practical strategies, examples, metrics, or policies for implementing and measuring sustainable practices at personal, organizational, or societal levels.	A document is relevant to the query "nachhaltigkeit" if it directly addresses sustainability — for example discussions of environmental, social, or economic sustainability, corporate sustainability reports, lifecycle assessments, policy papers, or case studies of sustainable practices in energy, agriculture, or supply chains. Documents that only mention the word in passing (e.g., a single sentence in a long unrelated article), use it as a marketing buzzword without evidence, or treat it metaphorically are less relevant because they do not provide substantive information on the topic. Language and terminology matter: German-language content containing “Nachhaltigkeit” is an obvious match, but English texts using “sustainability” or domain-specific terms (e.g., circular economy, ESG, carbon footprint) are also relevant; misspellings, OCR errors, or translations can create edge cases where relevant material might be missed. Authority and timeliness affect relevance too — recent research, government guidelines, and NGO reports are typically more useful than outdated blog posts or product listings — while pages where the term only appears in metadata, comments, or unrelated contexts (homophones, names) should be treated as non-relevant.
928	corona	variables	Wanting an overview of public attitudes and impacts of the coronavirus (COVID-19) in Germany — how people perceive infection risks, government measures and restrictions, and their effects on health, finances, schools, healthcare capacity, masks and tracing apps, travel/borders, protests, EU and rescue packages, and willingness to vaccinate.	This document is relevant to the keyword "corona" because it explicitly discusses the coronavirus pandemic using direct terms and German compounds (e.g., Corona, Coronavirus, CoronaKrise, CoronaMaßnahmen) and covers many core topics such as infections, public-health measures (masks, apps, lockdowns), vaccination, schools, economic relief, and regional policy responses. Concrete signals of high relevance include named events and actors (Trump infected, Tönnies outbreak), specific policies (mask mandates, contact‑tracing app), and temporal markers (week numbers) that show it is focused on COVID‑19 developments. It would be non‑relevant if the same token "corona" appears with a different meaning (solar corona, Corona beer, the Ford Corona automobile, corona discharge in physics, or a person’s surname) or only as an incidental string in unrelated content. Edge cases include partially relevant documents that discuss economic or political effects without explicit reference to the virus (these are somewhat relevant), concatenated German compounds or misspellings (e.g., CoronaKrise, CoronaMaßnahmen) which should be treated as matches, and materials that mention COVID topics but are fictional, satirical, or conspiratorial, which may be lower quality despite keyword overlap.
9616	politikverdrossenheit	variables	The user wants a concise paragraph explaining the German term "Politikverdrossenheit" (political disillusionment or apathy), including what it means, common causes, and its effects on civic participation. They likely need a short explanatory text suitable for an essay, article, or assignment.	Documents are relevant to the query "politikverdrossenheit" when they directly address political disaffection or apathy—explaining causes (e.g., corruption scandals, broken campaign promises, or economic inequality), describing manifestations (declining trust in parties, protest voting, youth disengagement, or falling turnout), or presenting measurements such as surveys and longitudinal studies. Relevant examples include empirical research on voter trust, news reports of a spike in non-voting after a scandal, policy analyses proposing re-engagement strategies, and comparative studies of political cynicism in Germany and other countries. Documents are not relevant when they only use the word in passing, focus on unrelated political topics (e.g., policy details without discussing attitudes), are purely promotional or spam, or treat "politics" in a generic sense without linking to disillusionment or participation. Edge cases include articles on low turnout that are relevant only if they connect turnout to attitudes; historical accounts are relevant if they trace causes or trends in disenchantment; and pieces using synonyms like "political apathy" or translations are relevant provided the conceptual link is clear.
14255	konsum	instruments_tools	The user seeks a concise explanation of consumer ethnocentrism — the belief that domestic products are superior to foreign ones — and how it is measured (the 15‑item short and 20‑item long CETSCALE). They want the theoretical background (Jacoby 1978) and the kinds of economic, social and moral beliefs the scale captures, such as the idea that buying foreign goods harms the domestic economy and increases unemployment.	This document is relevant to the query "konsum" because it directly describes consumers' beliefs about buying domestic versus foreign products and presents a 15- or 20-item scale measuring consumer ethnocentrism — a core aspect of consumption behavior. It is useful when the interest is in consumer attitudes, measurement instruments, references (e.g., Jacoby 1978), and how economic, social, and moral considerations shape purchase decisions (for example, shoppers who avoid imports to protect local jobs). It would be non-relevant if the query intends a different sense of "konsum" (such as medical drug consumption, substance use, or macro-level production statistics) or if a document only mentions the term without discussing consumer behavior. Borderline cases include papers on nationalism or trade policy that touch on consumer ethnocentrism (partially relevant) and highly technical psychometric reports that describe the scale structure but provide no context about actual purchasing behavior (less relevant).
15640	karriere	instruments_tools	The user is looking for information about a career-related questionnaire that measures three domains—career orientation, performance- and success-promoting work attitudes, and fear of failure—and wants to understand that its items are phrased to capture respondents' self-perceived, performance-related attitudes and behaviors.	A document is relevant to the keyword "karriere" if it deals with career orientation, career-related attitudes or measures—especially questionnaires and psychometric items that capture self-perceived, performance-related behaviors and fears (for example studies validating a career-orientation scale or vocational counseling instruments that assess fear of failure). Relevant examples include research on career orientation, instruments measuring success‑oriented work attitudes, and surveys that ask respondents to reflect on their career‑related behaviors and anxieties. Documents are non-relevant if they only use "karriere" in passing, discuss unrelated topics (e.g., product career metaphors, purely technical performance metrics), or focus on general personality constructs without any career context. Edge cases include papers that address fear of failure or work attitudes but not explicitly in a career context (partially relevant), documents in other languages or using synonyms like "Beruf" or "career" which should be matched by translation, and psychometric studies that are relevant only if their items explicitly target career constructs rather than broad self‑esteem.
1670	rassismus	instruments_tools	A person searching "rassismus" here likely wants to know how negative and positive attitudes toward outgroups are conceptualized and measured — specifically the distinction that they form independent continua and the existence of a German Allophilie scale (five subdimensions: affection, comfort, kinship, engagement, enthusiasm) and a Law-and-Order scale for xenophobic, state-control attitudes. They may also be seeking information on these scales' development (based on Pittinsky et al. and Fend) and their validation evidence (construct, convergent/discriminant, and criterion validity).	This document is relevant to the query "rassismus" because it describes validated instruments that measure attitudes toward outgroups—both positive (Allophilia: affection, comfort, kinship, engagement, enthusiasm) and negative (Law-and-Order: rejection of the foreign and support for coercive state measures)—which are central constructs in research on racism and xenophobia. It gives concrete details (scale structure, three items per subscale, validation with persons from foreign cultures) that make it useful for someone seeking measurement tools or empirical studies of prejudice. It may be less relevant if the searcher is looking for legal definitions, historical accounts, hate-crime case reports, or analyses of structural/institutional racism, because the paragraph focuses on psychological scales and attitudes rather than policy or lived incidents. An important edge case: Allophilia captures positive feelings toward outgroups and can miss subtle or covert racism, while the Law-and-Order scale targets authoritarian anti-foreigner tendencies—so researchers should consider adapting the scales if they need race-specific, systemic, or behavioral measures.
17057	kinderbetreuung	instruments_tools	The user is looking for information about childcare ("kinderbetreuung") — what types of care are available, how to find and enroll children, typical hours and age groups, costs, and any subsidies or regulations. Their goal is to choose and arrange appropriate, reliable care for a child.	Documents are relevant to the query "kinderbetreuung" when they directly address childcare: descriptions of daycare, kindergarten and after‑school programs; how to apply; opening hours; costs and subsidies; staff qualifications; legal definitions and local regulations. Highly relevant examples include municipal lists of childcare providers, application forms for a Kita place, fee schedules, eligibility rules for subsidies, or official guidance on child-to-staff ratios. Non-relevant documents either do not meaningfully discuss childcare (e.g., a passing mention of the word), cover unrelated topics that happen to include the term, or use the word in a different sense (such as a fictional title or an unrelated compound). Edge cases include materials where "kinderbetreuung" appears only in metadata or images (OCR may be needed), academic papers on early childhood theory that lack practical service information (partly relevant), or documents from other countries whose systems differ but still offer useful comparisons. Also consider language and recency: German-language, up‑to‑date local or legal information will usually be more useful than outdated or purely historical references.
17717	kinderwunsch	instruments_tools	The user wants information on "kinderwunsch"—people’s fertility intentions and desired number of children—and how family-related norms and attitudes (e.g., views on fathers’ parental leave, parental employment, and concepts of family and partnership) influence those intentions in Germany. They may also seek how these attitudes are measured in surveys (questions about actual and ideal number of children) and tested using cognitive interviews, as in the BiB pretest.	A document is relevant to the keyword "kinderwunsch" when it explicitly addresses fertility intentions or desired family size (terms like "gewünschte Kinderzahl," "ideale Kinderzahl," or "fertility intentions") or when it reports survey questions that measure people’s desire to have children. The paragraph is relevant because it explicitly mentions the desired and ideal number of children and tests attitude questions about parenting and parental leave using personally conducted cognitive interviews, which directly measure Kinderwunsch-related attitudes. Documents that analyze how family ideals, employment, or parental-leave policies influence the wish to have children are also highly relevant because they connect contextual factors to childbearing intentions. Edge cases include materials that only report fertility rates or demographic counts without assessing individual desires (partially relevant), papers focused on assisted reproductive technologies or clinical infertility care that use "Kinderwunsch" in a medical sense (potentially irrelevant to sociological intent), or discussions of family policy that never link to people’s childbearing intentions (less relevant).
19136	migra	instruments_tools	The user is looking for methods and tools to identify and measure migration background and related constructs (acculturation, ethnic/national identity, cross‑cultural loss, attitudes toward asylum seekers) in German research. Specifically they need information on survey items, validated scales and translations, psychometric properties, and practical implementation (e.g., SAS/SPSS/Stata code, Mikrozensus Scientific Use Files) for analysis.	A document is relevant to the keyword "migra" when it substantively discusses migration or migrants — for example items about "Migrationshintergrund," immigration and integration surveys (Mikrozensus, RESPOND), acculturation and identity scales, asylum-seeker questionnaires, or psychometric instruments and codebooks (SAS/SPSS/Stata) used to typify migration background. Strong signals of relevance include detailed methodology, questionnaire items, sample languages (e.g. Arabic, Farsi, Russian), validation statistics, or explicit focus on immigrant populations, whereas a single passing use of the word "migration" or a brief metadata tag is weak evidence. Non-relevant documents include cases where "migra" appears only as part of an unrelated word (e.g. "migraine"), a brand name, an unrelated acronym (MIGRA), or discussions of biological/animal migration with no human migration context. Edge cases to watch for are multilingual uses like Spanish "la migra" (immigration enforcement), internal versus international migration distinctions, or very short mentions that require more context — in those cases require additional topical content before labeling the document relevant.
21585	linksrechtsskala	instruments_tools	User wants a concise explanation of the "left–right scale" (Links-Rechts-Skala) as used in the PAWCER pretests: what it measures, how it is operationalized, and how it was tested. Specifically, they need to know that the scale maps respondents' ideological profiles across four subdimensions (economic libertarianism, conservatism, socialism, liberalism) by assigning scores to each dimension to enable individual and group comparisons, and that these questions were evaluated using face-to-face cognitive interviews.	A document is relevant to the query "linksrechtsskala" when it explicitly treats the Left–Right scale as an instrument — describing its operationalization, scoring and use (for example the four subdimensions: economic libertarianism, conservatism, socialism and liberalism), its application in cross‑national surveys such as PAWCER or the Values in Crisis study, or the pretest methods used (e.g. cognitive interviews, personally administered interviews). Concrete implementation details (question wording, subdimension items, scoring rules, translations or country versions) and empirical uses (comparisons of ideological profiles, links to welfare or climate attitudes) make a document especially relevant. Documents are non‑relevant if they only mention "left" or "right" rhetorically, treat left/right in nonpolitical senses (traffic, anatomy), or report a simple single‑item self‑placement without engaging the multidimensional LinksRechtsSkala or its measurement properties. Borderline cases include related two‑axis instruments (like the Political Compass) or theoretical discussions of ideology: these are partially relevant when they map economic and sociocultural dimensions or compare measurement approaches, but less so if they never address the specific subdimension structure or survey implementation.
