query_id	query	var_desc	var_narr
50270	digital skills	A summary of survey variables measuring respondents' self‑assessed digital technology skills across contexts (in daily life, for current job, for future job, for online learning, for using public services) along with related metadata (country ISO codes, respondent ID/caseid, year of birth, occupation codes) and items on perceived impacts of recent digital technologies. The information need is to locate and understand these digital‑skills items and their coding/availability in the ISSP datasets.	A document is relevant to the query "digital skills" when it explicitly contains measures or question text about individuals' ability to use digital technologies—e.g., qd4 items such as "RESPONDENT DIGITAL TECH SKILLS IN DAILY LIFE," "TO DO JOB," "TO DO FUTURE JOB," "DIGITAL ONLINE LEARNING," or the self‑assessment phrasing "You consider yourself to be sufficiently skilled in the use of digital technologies." Material about the broader impacts of digital technology (qd1 items on economy, society, quality of life) is related but only indirectly relevant unless it also reports on respondents' actual skills. Documents that only contain administrative metadata—CASEID, ISO country codes, year of birth, occupation codes, or repeated variable codes without any skill items—should be considered non‑relevant. Borderline cases include codebooks or survey documentation that list qd4 variable names without item wording (partially relevant) and noisy, duplicated exports where the qd4 items are present but buried among repeated metadata (relevant but lower quality for extraction).
505	diskriminierung	The user wants to identify the primary reason for discrimination experienced in their main occupation, corresponding to survey variable EB0215P. They are seeking a concise answer listing or selecting the main motive (e.g., gender, age, ethnicity, religion, disability) that best explains the discrimination.	A document is relevant if it explicitly contains the EB0215P variable or question text asking “What was the main reason for discrimination in your main activity?” and provides a clear answer or coding for that main reason. Relevant examples include transcripts or datasets that list a respondent’s single primary reason (e.g., gender, ethnicity/race, age, disability, religion, sexual orientation, nationality, language, political opinion) or a codebook that defines EB0215P categories and their labels. Partially relevant documents are translations, synonyms, aggregated frequency tables, or metadata that map directly to EB0215P (these are useful but may lack individual-level answers). Non-relevant documents are ones that only discuss discrimination in general, address other survey variables or paragraphs (e.g., EB0216), provide legal/policy analysis without the EB0215P question, or mention multiple causes without identifying which was the “main” reason. Edge cases to watch for include missing/null responses, entries that list several reasons without indicating the primary one, and near-matches where phrasing differs (Hauptgrund vs. Haupttätigkeit) — these reduce relevance unless they clearly tie back to the EB0215P question.
50992	digitalisierung arbeit	User wants survey questions, variables and statistics about how digitalization affects work — e.g., job satisfaction, teleworking or working at different locations, time pressure, part-time work, public vs. private sector differences, self‑employment networks and managerial responsibilities. They are trying to find relevant survey items and data to analyze the relationship between digitalization and working conditions.	A document is relevant to the query "digitalisierung arbeit" when it explicitly connects digitalisation (e.g., ICT adoption, automation, platform work, telework, digital workplace tools, or digital skills training) to employment issues such as changing job tasks, work organisation, job satisfaction, or skill requirements. The paragraph you provided mainly lists survey items about job satisfaction, workplace location, responsibility for others, and party performance, without mentioning digital technology, so it would generally be non‑relevant unless specific items or results tie those questions to digital work arrangements. Partial or borderline relevance arises when a text mentions “digital” only in passing (e.g., a single metadata tag) or discusses telework/remote work without framing it as a digital transformation issue—those require closer inspection of methods and findings. Another edge case is documents about digitising public administration: they are relevant only if they analyse effects on jobs, roles, or employee skills; otherwise they are about service delivery rather than "arbeit." To decide fast, prefer documents that contain concrete measures or outcomes linking technology and work (examples, statistics, interventions, or policy impacts); mark as non‑relevant if the content is only generic employment survey variables or political commentary with no digital context.
51730	alkohol	The user is seeking information about alcohol focused on survey-style measures and public attitudes. Specifically they want data/questions on drinking behavior (age of regular drinking onset, days with 5+ drinks in the past 30 days), perceptions of being detected when driving under the influence, and opinions on tougher penalties and alcohol as a social/political problem.	A document is relevant for the keyword "alkohol" when it contains substantive discussion of alcohol use, such as survey questions about drinking frequency or age of initiation, descriptions of binge drinking ("5 or more glasses" in the last 30 days), blood‑alcohol scenarios ("08 Promille"/0.8‰) or alcohol‑related offences and policy ("Alkohol am Steuer", higher fines from 2009). The supplied paragraph is highly relevant because it repeatedly names "ALKOHOL AM STEUER", asks about how often people drank, the age they began drinking regularly, and hypothetical detection probabilities for driving with high blood alcohol — all direct matches to search intent. It is less relevant when "alkohol" appears only as a single entry in a long, general topic list or as part of repeated metadata/codes (e.g. V75, cp02) without explanatory text, because those mentions lack substantive content. Edge cases to watch: mentions of "alcohol" in a chemical/industrial sense, negated forms like "alkoholfrei", translations or misspellings, or boilerplate repetitions — these can produce false positives or require downgrading despite containing the keyword.
5274	familie	The user is asking about "family" in the context of a workplace/survey topic — wanting to know who people count as family and how "family" is defined. They also seek views and information on reconciling work and family life (possibilities and employer provisions for balancing career and family).	A document is relevant to the query "familie" when it explicitly discusses family as a topic—for example the repeated survey items in this paragraph like "Was meinen Sie zum Thema Beruf und Familie" or the definitional prompt "WENN WIR HIER SO VON FAMILIE SPRECHEN AN WEN DENKEN SIE DABEI". Relevance is stronger when the term appears in headings, question text, or extended discussion (e.g., family–work reconciliation), not just as a stray token. Non-relevant documents would only contain the string as part of codes or labels (e.g., "V206 VEREINB. FAMILIE" with no substantive content), as a company/name unrelated to household/family topics, or only in irrelevant metadata. Edge cases include inflected or compounded forms (Familie, Familien, Beruf und Familie) and boilerplate or heavily duplicated text: such documents match the keyword but may offer little useful information unless context shows an actual discussion or question about family.
5275	democracy	A user searching "democracy" here is looking for how people view the idea of democracy itself—whether they support it and how essential they consider specific features (e.g., free elections, civil rights, gender equality, redistribution, welfare, military intervention, religious law, obedience to rulers). They likely want survey-style measures or questions and public-attitude data about which characteristics define or matter for democracy.	A document is relevant to the query "democracy" when it directly discusses the IDEA OF DEMOCRACY or how people understand and evaluate democratic characteristics — for example survey items that ask whether one is for or against democracy or to rate essential features on a 1–10 scale. Concrete indicators of relevance include explicit mentions of free elections, civil rights, equality of incomes, women's rights, taxing the rich/subsidizing the poor, military takeover when governments fail, religious authorities interpreting laws, or state unemployment aid, since these show which attributes are being judged as democratic. Format and context matter: transcripts or questionnaires that repeatedly prompt “in principle are you for or against the idea of democracy” or include question codes (Q39A, pd12, v14) are relevant but may be lower quality if they contain excessive duplication or metadata noise. Borderline or non-relevant cases include texts that only name “democracy” in passing (e.g., as a label, place, or slogan), documents focused solely on specific policy advocacy without tying those policies to the concept of democracy, or files that are mostly corrupted/redundant text and offer no substantive discussion of democratic ideas.
52895	inequality	The user is looking for survey-based information on social and gender inequality, including public attitudes about causes (e.g., benefits to the rich, lack of unions), responsibility, urgency, and preferred remedies. They also want measures of priorities for EU action, perceptions of change over time, and expectations about future inequality.	A document is relevant to the query "inequality" if it discusses inequality substantively — for example by naming types (gender, social-class, income), giving survey question text or variable labels (ISSP items like "Inequality continues to exist because it benefits the rich and powerful" or Q99 "means to reduce sex inequalities"), describing causes (lack of unions, benefits to the rich), policy responses (EU gender policy, priority areas) or trends over time (compared with 10 years ago, future importance). Highly relevant examples include pages that show ISSP question wording and variable codes (ZA1680, ZA3430, V9, V21), lists of urgent gender-inequality issues (being paid less, prejudice, underrepresentation in responsible positions), or explicit proposals for reducing inequality. A document is non-relevant if it only contains unrelated codes or noise (repeated variable IDs with no question text), discusses mathematical inequality symbols rather than social inequality, or only mentions "inequality" peripherally without substantive content. Edge cases include files that contain the right variable codes but omit full question wording (ambiguous for indexing), or documents that focus on one subtype (e.g., racial inequality) — still relevant but should be labeled for the specific subtype and timeframe. For useful retrieval, prefer documents that pair human-readable question text with variable identifiers, context (country, year), and whether the item addresses causes, impacts, or policy solutions.
5335	social media nutzung	Looking for information on social media usage in Germany — who uses which platforms, how often and for what purposes (communication, news, learning, entertainment), and how use varies by demographics and attitudes (privacy, copyright, civic participation).	A document is relevant to the query "social media nutzung" if it explicitly discusses use of social media platforms, behaviors on networks (frequency, purpose, demographics), platform features or policies, or mentions specific social platforms (e.g., YouTube, Facebook, Instagram) or user-generated content. For example, survey items about "Nutzung von Informationsangeboten im Internet," questions mentioning YouTube, or debates about platform liability for copyrighted material are likely relevant because they touch on how people use online platforms. Documents about social benefits, tax policy, coal mining (Lützerath), or household net income are non-relevant unless they directly link those topics to social media use. Edge cases include generic references to "internet use" or "Nutzung von Informationsangeboten" without naming social networks — these are weakly relevant and require context to decide — and copyright/Internet-platform items, which become relevant only when they explicitly involve social media or user uploads.
5377	social media use	A survey asking whether respondents follow debates on social media, how they evaluate media coverage of poverty and social exclusion, which media sources they use most often (first and second), and whom they would contact if their social media or email account were hacked.	Relevant: this paragraph explicitly contains the question "Do you follow debates on social media..." and media-use variables (qp16a/qp16b) that list "ONLINE SOCIAL MEDIA" and other media types, so it directly matches a query about social media use. It also includes coding labels and response options (e.g., television, internet websites, radio, written press) which are useful if you want the survey wording or item coding for social media-frequency research. Non-relevant: much of the text is duplicated and noisy and many lines concern other topics (questions about how the media cover poverty, cybercrime contacts for hacked accounts) that are adjacent but not central to measuring social media use. Edge cases: treat this document as relevant when you need questionnaire items, variable names or examples of response options, but not relevant if you expect aggregated usage statistics, analytic results, or cleanly formatted data; the repetition and mixed topics mean you’ll need to clean or extract the social-media items before analysis.
53774	berufsausbildung	User wants to know whether a person (self or the household's main earner) has a completed vocational training ("abgeschlossene Berufsausbildung") and how that status is asked or recorded on forms (e.g., the question "Haben Sie eine abgeschlossene Berufsausbildung?").	A document is relevant when it explicitly records or asks about a completed vocational training — i.e., contains the phrase “abgeschlossene Berufsausbildung” or close variants and survey field labels such as v75, v154, V294, V295, zu02, etc., or headings like “Haben Sie eine abgeschlossene Berufsausbildung”, “EIGENE BERUFSAUSBILDUNG” or “BERUFSAUSBILDUNG DES HAUPTERNÄHRERS.” Examples of highly relevant material are questionnaires, census forms, or database fields that store answers to that exact question or its abbreviations (e.g., “ABGESCHL. BERUFSAUSBILD.”, “ABGESCHL.BERUFSAUSBILDG.”). Documents are not relevant if they only mention general education or other credentials (university degree, continuing education), discuss ongoing or incomplete training (e.g., “Ausbildung abgebrochen” or “in Ausbildung”), are in unrelated languages, or contain the term only as OCR noise or repeated metadata without substantive content. Edge cases include synonymous wording (“Lehre”, “Ausbildung abgeschlossen”), foreign/recognized vocational qualifications, or records that contain the field codes but lack answer content; these should be reviewed individually to decide if they meet the query intent.
5407	medien	The user is looking for public-opinion survey items and measures about the media — e.g., how often people use TV/press/radio/internet and social media for political information, perceptions of media bias and influence (including coverage of politicians and scandals), and attitudes toward media reporting on topics like right‑wing extremism, gender‑inclusive language, DDR coverage, and whether people contacted authorities or the media about grievances. They need concise examples of questions assessing media use, trust, perceived fairness, and topic interest.	A document is relevant for the keyword "medien" when it directly discusses media as an institution or information source — for example when it reports on media coverage of politicians (Christian Wulff, Michel Friedman, Peer Steinbrück, Gerhard Schröder), asks how often people use television/newspapers/radio/the Internet for political information, or surveys opinions about media influence, right‑wing extremism in the media, or gender‑neutral language in the media. The provided paragraph is highly relevant because it repeatedly names "Medien" in questions about coverage, frequency of use, influence on political opinion, and social media as an information source, and even contains concrete survey items (e.g. ZA5573 2008) and topical examples. Non‑relevant documents would only contain "Medien" as a field label or code (V270, V311) with no substantive text, use "medien" as a substring in unrelated words, or discuss other kinds of media (e.g. biological culture media, multimedia file formats) that are not about news/communication. Edge cases include survey forms that mention "soziale Medien" but focus on other topics (relevant but lower priority), duplicate boilerplate lines (add little new information), and multilingual corpora where "medien" appears incidentally — these should be checked for actual topical content before scoring them as fully relevant.
54621	beschäftigungsverhältnis	The user is looking for wording to determine a person's current employment relationship—specifically the type of contract and whether it is fixed‑term—and to ask if they searched for paid work in the past four weeks (including those currently in permanent jobs). This is likely for survey or questionnaire items about employment status and recent job‑search activity.	A document is relevant if it explicitly addresses the German survey phrasing and concepts in the query — for example it contains the questions "In welchem Beschäftigungsverhältnis stehen Sie?", "Ist Ihr Beschäftigungsverhältnis befristet?", or wording about "Suche nach bezahlter Tätigkeit in den letzten 4 Wochen", or if it includes the variable codes (v05001, w06001, etc.) with definitions. Highly relevant examples are questionnaire forms, survey codebooks, data dictionaries or methodology notes from labor force surveys that list those exact items and response categories (e.g., fixed-term vs. permanent, searching for paid work). Non-relevant documents include general articles on employment law or job market trends that do not specify contract type or recent job-search behavior, job postings, or texts about unpaid/volunteer work that use different timeframes or criteria. Edge cases include documents that mention "befristet" or "Beschäftigungsverhältnis" in a different legal/sectoral context, items that refer to job-seeking without clarifying "paid" or the "last 4 weeks", or datasets that list variable codes without accompanying question text — these may be partially relevant if you can map codes to questions but are weaker than full question-and-response documentation.
54995	arbeitgeber	A summary of employer–employee relations and policies, particularly employer countermeasures to strikes (lockouts) and public opinion on whether employers should be allowed to lock out workers. Also seeks routine employment details and contract information—start date, written vs. oral agreement, control over working hours, supervisory responsibility, and employer contributions to social/care insurance.	A document is relevant to the query "arbeitgeber" when it explicitly discusses employers or employer-related actions, roles, policies, or survey questions — for example mentions of "Arbeitgeber", "Arbeitgeberbeitrag", lockouts ("Aussperrung"), employer-determined working hours, start dates with the current employer, or whether an employer pays part of insurance costs. Passages that pose questions about being employed by or responsible for others, that describe employer–union agreements, or that record employer contributions are good evidence of relevance. Conversely, a document is non-relevant if the word appears only in passing (e.g., as a fragmentary code label like V120), in boilerplate lists without substantive context, or as an unrelated name in a directory. Edge cases include compound terms and synonyms ("Firma", "Dienstherr", "Arbeitgeberbeitrag"), different word forms or languages (German vs English), and texts about employers in peripheral contexts (taxation, historical mentions) where the match may be superficial; examining nearby verbs, policy terms, or question formats helps disambiguate intent.
55053	arbeit zufriedenheit	The user is seeking survey measures and questions related to work satisfaction, including willingness to work even when not searching for a job, frequency of working under time pressure, and collaboration among self‑employed. They also want items about perceived government competence (federal or state, party-led governments) in solving economic and public‑policy problems to the respondent’s satisfaction.	A document is relevant to the query "arbeit zufriedenheit" if it directly addresses individual job satisfaction or work conditions — for example survey items about working under time pressure, willingness to work even when not seeking a job, collaboration in a self-employed network, or explicit phrases like "Arbeitszufriedenheit" or "Wie oft arbeiten Sie ... unter Zeitdruck." The paragraph contains several clearly relevant lines (e.g., "Wie oft arbeiten Sie bei der Erledigung Ihrer Arbeit unter Zeitdruck" and "Auch wenn Sie keine Arbeit suchen würden Sie dennoch gerne arbeiten"), and its German wording matches the query language, which increases relevance. It is non-relevant when the text focuses on political or fiscal topics (e.g., which government can fix the federal budget, party labels like CDU/SPD, economy or terrorism questions) that do not concern personal work satisfaction. Edge cases include texts that mention "Arbeit" in a political sense ("Arbeit der Regierung") or "Zufriedenheit" with government performance — these are false positives unless they also include individual-level job satisfaction items; mixed documents that contain both political and work-satisfaction questions can be partially relevant, with relevance proportional to the amount and prominence of the job-related items.
55130	arbeitsbedingungen	The query seeks survey items about working conditions in a person’s main job, asking how often various adverse conditions occur and to what extent the job is characterized by them. Key factors queried include heavy physical work, workplace stress, shift work, poor work climate, noise/poor air, long working hours, and time/performance pressure.	A document is relevant to the query "arbeitsbedingungen" when it explicitly addresses working conditions or lists exposures such as Schichtarbeit (shift work), schwere körperliche Arbeit (heavy physical work), Lärm, schlechte Luft, lange Arbeitszeit, Leistungsdruck, or workplace stress — for example, survey items beginning "Wie oft..." or stems like "Ist Ihre jetzige berufliche Tätigkeit..." are direct indicators of relevance. It is non‑relevant when the content only contains unrelated administrative codes, formatting artifacts, repeated boilerplate with no substantive information, or primarily concerns pay, hiring, or job titles without any reference to working conditions. Edge cases include documents made up of variable names and abbreviations (e.g. "Arbeitsbed.", "V294", "hw05"): these often signal a questionnaire or codebook and can be relevant for measurement purposes, but may be borderline if they contain no question wording or explanatory context. Prioritize texts that provide full question wording, frequency scales, or descriptive discussion of exposures; treat isolated metadata or duplicate lines as lower priority unless you specifically need the instrument or coding details.
