query_id	query	var_desc	var_narr
32738	sicherheit	The user wants to know how people perceive safety in different areas—public places, law and order in Germany, internet security, job security and social security—and whether they feel personally protected. They also seek to identify which aspects of security respondents find lacking today.	A document is relevant to the keyword "Sicherheit" when it explicitly discusses security-related topics—such as "Sicherheit im Internet" (internet security), "Sicherheit des Arbeitsplatzes" (workplace security), "soziale Sicherheit" (social security), or safety in public places—as in the supplied paragraph which lists survey questions about those areas. It is non-relevant when the term appears only incidentally (for example in a compound noun unrelated to the user's intent, a brand name, or as repeated survey codes like V274 without substantive content) or when the word occurs in a different language context that changes meaning. Edge cases include terse transcripts or questionnaires that name the topic but give no explanatory content (these are partially relevant because they indicate subject matter but lack depth), and technical documents about safety equipment or legal regulations which may be relevant only if the user seeks that specific angle. Finally, relevance depends on user intent: a broad query for "Sicherheit" makes any of the above topics useful, whereas a query for a specific subtype (e.g., cyber security vs. social security) requires matching that particular term or related synonyms to be truly relevant.
3294	haushaltseinkommen	The query seeks survey information about household net income: which income bracket the household falls into, the respondent’s and the household’s net income for the last month, and how many people (including pensioners, scholarship recipients, etc.) contribute to that income. It also asks for a subjective assessment of how easy or difficult it currently is for the household to make ends meet.	A document is relevant if it explicitly deals with "Haushaltseinkommen" — for example survey questions, codebook entries or variable definitions that ask for monthly net household income after taxes and social security, income-class categories (e.g. s09, s09hhek, ekdm), or instructions to include all income sources (wages, pensions, stipends). Text that reproduces the questionnaire wording (How high was your personal/net household income last month? How many people contribute?) or lists the specific income bands (including historical DM categories) is highly relevant because it matches the query intent exactly. It is non‑relevant if the document only mentions individual gross income, corporate revenues, household chores, or uses "Haushalt" in a non‑income sense, or if it merely cites the term without any definitions or question text. Edge cases include translations or abridged summaries (potentially relevant if they preserve the monthly net/inclusion rules), materials using a different reference period or currency (annual vs monthly, EUR vs DM) which may require normalization, and machine‑read transcripts or repeated boilerplate that contain the keywords but lack usable metadata or context.
3297	schulische bildung	The user is looking for information about school education in Germany, specifically public attitudes on whether enough is being done for schools and how recent changes in school or vocational training (over the last 12 months) affect career prospects. They also want to capture related survey concerns such as interrupted career plans, inability to finish apprenticeships, fewer suitable training places, underemployment or involuntary part‑time work, and planning of professional careers.	A document is relevant to the query "schulische bildung" if it focuses on school education in Germany—discussing school quality, policy debates (for example, "Wird in Deutschland genug für Schulen getan?"), or first-hand and survey-based accounts of pupils’ and apprentices’ experiences. Relevant examples include analyses of vocational training outcomes (completion rates, fewer apprenticeship places, later underemployment), survey questions about changes to one’s school or vocational education in the last 12 months, and policy proposals affecting schools. Non-relevant documents are those about unrelated topics (e.g., the founding of the Federal Republic), texts that only contain repeated codes or filler without substantive education content, or pieces that treat "Bildung" only as a vague term for lifelong learning or higher education without addressing schools. Edge cases include materials that mention schools only in passing, survey instruments that list questions without results (useful for methodology but limited for content), or documents in another language—these can be partially relevant depending on whether they provide concrete information about school education in Germany.
32984	security	The query seeks survey information on "security," specifically asking what makes people feel financially secure and whether they consider their own financial position secure. It also asks about respondents' awareness of EU external border initiatives (e.g., Frontex, ETIAS, EES, SIS, VIS, Internal Security Fund) and how important they view internal security challenges like terrorism and border protection.	A document is relevant to the keyword "security" when it explicitly addresses security topics, such as personal financial security (questions about what makes you feel financially secure or whether your financial position is secure) or public/internal security (importance of terrorism or EU border security and awareness of initiatives like FRONTEX, ETIAS, EES, SIS, VIS). For example, the listed variables Q21 and Q22A about financial position and savings, and qa19/qa3/qb2 about awareness of border initiatives and the importance of terrorism/EU borders, are clear signals of relevance. A document is non-relevant when it only contains unrelated administrative codes, repeated labels with no substantive content, or discusses an unrelated sense of security (e.g., software/IT security) that does not match the user's intended topics. Edge cases include brief code-lists or variable names that imply security questions—these can be considered marginally relevant if no question text is present, and ambiguous uses of "secure" (secure employment vs cybersecurity) should be judged by surrounding context. Prioritize texts that explicitly mention financial security, terrorism, border control, or named EU initiatives as highly relevant; treat vague or context-free mentions as low relevance.
3307	political participation	The user is looking for how "political participation" is measured in survey data — the specific questionnaire items and variables that capture different forms of engagement (e.g., party membership and activity, frequency of participation in political groups, online discussion/sharing, self-rated involvement, and encouragement to vote). They also want details on topic-specific items (EU enlargement/defence debates), longitudinal participation indicators, and variable coding/derivations.	A document is relevant to the keyword "political participation" when it directly addresses citizens' political actions or engagement — e.g., survey questions or variables about attending party activities, belonging to a political party, voting intentions, following or taking part in online election discussions, or using new technologies to express political opinions. Good examples are items like "In the past 12 months how often have you participated in activities of political parties…" or Q12 entries about online voting and expressing opinion, and membership/status items that distinguish belonging and active participation. A document is less relevant if it only discusses states' or institutions' participation (for example Ireland joining a collective EU defence), reports policy attitudes without any behavioral participation measures, or contains only administrative variable codes with no question text. Edge cases include texts that use the word "participation" in non-political contexts (child or household participation in longitudinal waves) or repeated metadata where the question intent is unclear; these should be checked for accompanying question wording before being treated as relevant. In practice, prioritize documents with explicit participation behaviors, frequency measures, or membership/online-engagement items; deprioritize ones with only topic opinions, institutional participation, or bare variable identifiers.
3340	sex	The user is looking for the survey variable that records respondents' sex/gender — i.e., "Sex" or "Sex of respondent" — across multiple ISSP waves and dataset variable IDs. They want to identify where this variable appears (for example ZA1840, ZA3090, ZA4350, ZA5800, ZA6770, ZA7600, etc.) to locate or harmonize it for analysis.	A document is relevant to the keyword "sex" when it clearly refers to a survey variable or field about respondents' sex/gender—for example lines that say "Sex of respondent," include variable names like "SEX V119" or codes such as "ZA5800" and survey identifiers like "ISSP 2011," which indicate a dataset variable rather than unrelated text. Concrete indicators of high relevance are question wording, variable IDs (v119, v296), dataset codes (ZA3090), and notes about how the variable is coded (male/female, missing codes). A document is non-relevant when "sex" appears only as noisy repetition, as part of other words or acronyms that are unrelated to respondent sex, or when the text discusses sexual activity or biology rather than a dataset variable. Edge cases include ambiguous uses where "Sex" could mean biological category versus sexual behavior, or when formatting/typos merge tokens (e.g., "SEXISSP")—in those cases you should check nearby context (survey name, variable code, question text) to decide relevance. Finally, brief lists of repeated tokens are lower quality matches even if they technically contain "SEX"; the most useful documents include descriptive metadata, coding schemes, or full question text.
33461	rechts links	The query seeks survey measures of political orientation asking respondents to place themselves on left–right scales (e.g., 0–10 or 1–11) or indicate if they are left or right. It also asks for comparative ratings of East vs. West Germans using bipolar adjective scales, marking how strongly opposing traits apply.	A document is relevant to the keyword "rechts links" if it explicitly discusses the political left–right spectrum, especially in the form of survey items or self-placement scales using German terms like "links", "rechts", "Selbsteinstufung", "Einstufung", "Kontinuum" or "Skala". For example, questionnaires asking "Wo würden Sie sich auf einer Skala von 0 bis 10 einordnen?" or "Wenn Sie diese Skala von 1 bis 11 benutzen, wo würden Sie sich selbst einordnen?" are highly relevant because they frame left/right as ideological self-placement. Non-relevant documents include literal directional instructions ("turn left/right"), clinical descriptions of left/right body sides, files or code that only contain the tokens "links" or "rechts", or texts where "Rechts" refers to law or party names without ideological scale context. Edge cases to watch for are bilingual or ambiguous uses (e.g., "links" as hyperlinks or "Die Linke" as a party name), repeated boilerplate survey items (which indicate a questionnaire but may be low-quality or duplicated), and passages that mention the words without any political or survey context — these reduce usefulness even though they contain the keywords.
3365	drogen	A person searching "drogen" here is likely looking for the survey instrument content about drugs — specifically questions on frequency of drug use in the past 12 months (e.g., hashish, marijuana, cocaine, heroin), attitudes toward decriminalizing possession of small amounts (including hard drugs), and the survey coding/listing where "Drogen" appears as a societal/political problem. They want the exact question wording, response options/codes, and how the topic is categorized among other public issues.	A document is relevant to the keyword "drogen" if it directly discusses drugs—especially survey questions or metadata about drug use (for example the repeated question "Wie häufig haben Sie in den letzten 12 Monaten Drogen z.B. Haschisch, Marihuana, Kokain, Heroin … konsumiert"), attitudes toward decriminalization (e.g. F.85a asking whether possession of small amounts should be punished), or coding entries like "58. Drogen" and related variable names (v33001, V207, F.2). Concrete evidence of relevance includes lists of specific substances, frequency-response options, question IDs or codebook entries that map responses to "Drogen", and policy/attitude items about hard drugs. A document is non-relevant if it merely contains the substring "drogen" in passing among many unrelated topics, discusses pharmaceutical drugs in a clinical dosing context without reference to substance use or policy, or only has noisy/duplicated text that obscures any substantive drug-related content. Edge cases to watch for are synonyms and language variants (English "drugs", "narcotics", or German OCR errors that split or misspell "Drogen"), survey fragments that only list "Drogen" as one item among many (lower relevance unless accompanied by questions or codes), and documents that mention drug-related codes (v33001, F.85a) — these are often highly relevant even if the human-readable question is truncated. A practical heuristic: prioritize documents containing explicit drug-use questions, listed substances, or decriminalization/attitude items and treat brief or ambiguous mentions as lower relevance unless corroborated by codes or full question text.
34145	rechtsextremismus	The user is looking for information about right‑wing extremism in Germany — specifically public attitudes, media coverage, perceived threat to democracy, whether enough political and legal action is taken (laws against right‑wing extremism), and survey data (e.g., ZA5573 2008) about these perceptions, including concerns about right‑wing views in the police.	A document is relevant to the keyword "rechtsextremismus" when it explicitly addresses Rechtsextremismus or close variants (e.g., rechtsextreme, Rechtsextreme), discusses legal measures, media coverage, surveys or public opinion (for example the ZA5573 2008 survey items or legislative tags like V199/V186), or treats police involvement and threats to democracy in the context of right‑wing extremism. It is non‑relevant when the word is absent or only generic terms like "extremism" are used without a right‑wing qualifier, when "right" appears in a non‑political sense, or when a file contains only administrative codes, repeated headers or metadata with no substantive content. Edge cases include documents in German with morphological variants or compound words (e.g., rechtsextremes Gedankengut) and translations — these should be matched by stem or synonym lookup because they are often highly relevant. Repeated survey text or media mentions can create noise: repeated headers or duplicated lines are less useful by themselves but still relevant if they contain actual survey questions or analysis. Finally, broad anti‑extremism policy pieces are borderline: they are relevant if they specifically address measures against right‑wing groups, but less so if they only discuss extremism in general without reference to the right‑wing dimension.
3420	left right	Identify survey variables that measure left–right ideological placement—both respondent self-placement and placements of parties and leaders—on 0–10 (or 1–10) scales, including harmonised and recoded/derived versions for comparing respondent and party/leader positions.	A document is relevant to the query "left right" when it discusses the political left–right spectrum or its measurement — for example survey questions or codebook entries that ask respondents to place themselves, parties, or leaders on a 0–10 or 1–10 left–right scale (e.g. V76 Left Right Selfplacement, v241/v242 harmonised or recoded variables, PARTY LR, or items asking about PARTY A or LEADER A). It is non-relevant when "left" and "right" are used as literal directions, handedness, UI layout or other non-political contexts, or when the terms appear only as unrelated field names with no scale or ideological context. Edge cases include snippets that contain variable names like "LEFT RIGHT PLACEMENT HARMONISED" but no question text — these are likely relevant if they are part of a survey codebook or recode documentation, but ambiguous if isolated. Repetition of recode/harmonised labels, explicit scale wording ("where would you place yourself on a scale from 0 to 10") and references to parties or leaders are strong signals of relevance; absence of those cues reduces relevance.
3474	arbeitszeit	The user is looking for information about working hours (Arbeitszeit): who sets schedules and whether employees can choose start/end times, use flexible hours or time accounts, overtime rules, reducing hours before retirement, and how these issues feature in collective bargaining (e.g., metal/electrical industry and public-sector disputes).	A document is relevant to the keyword "arbeitszeit" when it substantively discusses working time issues — for example reduction or increase of hours, overtime, flexible/gleitende Arbeitszeit, Arbeitszeitkonten, who sets start and end times, or collective-bargaining disputes about hours. Strongly relevant passages are full sentences like survey questions about reducing hours before retirement, whether the employer fixes schedules, records of hours worked beyond contract, or debates in the metal/electrical industry over shorter or longer workweeks. A document is less relevant if "arbeitszeit" appears only as an administrative code, repeated token, or header (e.g., V241 ARBEITSZEIT LOHNAUSGLEICH) with no explanatory text, or if it occurs incidentally in a list of topics without substantive content. Edge cases include OCR/encoding artifacts (e.g., "uuml ber" for "über"), concatenated or abbreviated forms ("ARBEITSZEITVERK."), or mentions in a non-labor context (machine uptime vs. employee hours) — these should be considered relevant only if surrounding context clearly matches the labor-related sense.
36787	sustainability	Aims to measure public opinion in the EU about which policy measures should be prioritized for sustainable growth (e.g., environment‑friendly production, support for agriculture, innovation and ICT investment, consumer rights, public service reform, migration control, enterprise creation). It also seeks to assess awareness of the UN Sustainable Development Goals and views on how the EU should ensure its imports are sustainable (mandatory requirements, trade policy leverage, or responsibility of exporting countries).	A document is relevant to the keyword "sustainability" when it explicitly discusses sustainable concepts, policies, or indicators — for example references to sustainable growth, the Sustainable Development Goals (SDGs), environmentally friendly production, or measures to ensure EU imports come from sustainable sources. Items that name specific policy options (supporting sustainable agriculture, obliging exporters to meet sustainability requirements, applying global trade policies, reinforcing consumer rights or investing in green ICT) are clearly relevant because they address practical routes to sustainability. A document is non‑relevant if it only contains unrelated material or purely technical metadata — for instance long runs of repeated question codes or prompts with no substantive content about sustainability. Borderline cases include survey transcripts or lists of response labels that mention "sustainable" only as a tag: these are useful for detecting topic presence but provide limited insight for policy or conceptual analysis. Finally, passages that use "sustainable growth" in a narrow economic sense (e.g., only promoting high‑speed internet or enterprise creation) are partially relevant but may miss environmental or social dimensions of sustainability.
37090	stress arbeit	The user is looking for survey items and variables measuring work-related stress and related job characteristics — e.g., frequency of feeling stressed, changes in stress over time, time pressure, overall job satisfaction, willingness to keep working, responsibility for other employees, workplace location/sector/type, and other employment conditions. They likely want these items to analyze workplace stress and its correlates.	A document is relevant to the keyword "stress arbeit" if it explicitly addresses stress at work — for example survey items asking whether respondents feel "oft/manchmal/selten/nie im Stress," whether stress has increased or decreased over the years, or how often people work under time pressure. Clear matches include German question text like "Wenn Sie einmal an Ihre tägliche Arbeit denken: fühlen Sie sich dabei oft, manchmal, selten oder nie im Stress?" or items measuring frequency of working under time pressure. Documents are non-relevant when they focus on unrelated topics that happen to appear in the same corpus (e.g., party politics, country of work, public vs. private sector comparisons, or reasons for part‑time work) unless those sections explicitly tie back to workplace stress. Edge cases: a text that mentions "stress" in a different sense (mechanical/physiological stress) or uses only metadata variable names (V99, Q16) without the actual stress question is not relevant; conversely, documents that do not use the word "stress" but measure time pressure or job strain can be partially relevant as proxies. Duplicate survey blocks or repeated wording count as relevant if they include the stress items, but mere lists of variable names without content should be considered non‑relevant.
38053	social status	Looking for definitions and survey measures that capture an individual's social status in demographic data. This includes variables for occupation and current employment, marital status, household role (head or spouse/partner), and broader socioeconomic position.	Relevant documents are those that explicitly define, list, or measure indicators of social status — for example occupation/occupation status, current employment status, socio‑economic status, marital status, head‑of‑household or main source of living — such as survey questionnaires, dataset codebooks, or research that uses variables like V133, V125, Q110a, etc. A paragraph like the one above, which enumerates variable names and labels for occupation, marital and household roles, is a good match because it clearly maps the constructs used to capture social status. Non‑relevant documents would be those that use the word “status” in a different sense (system status, health status, order status) or only contain isolated repetitions of the token “status” without contextual definitions or measures. Edge cases include files that mention one indicator (only marital status or only employment) — these can be relevant if the user accepts single‑indicator measures — and ambiguous variable labels (e.g., MAINSTAT, SPMAINST) that require metadata checking to confirm they refer to social status.
38113	social mobility	A clear explanation of what social mobility is — how and why individuals or families move up or down socioeconomic strata — including its types (intergenerational vs. intragenerational), common measures (income, education, occupation), and the main factors that affect it. The user may also want evidence on trends and cross-country comparisons, and policy options to increase mobility.	A document is relevant to the query "social mobility" when it directly discusses changes in people’s socioeconomic position over time or across generations — for example analyses of income mobility, intergenerational earnings elasticity, occupational or educational transitions, mobility matrices, longitudinal studies, or evaluations of policies (like education or tax reforms) intended to increase upward mobility. Relevant documents typically present measures, empirical evidence, country or cohort comparisons, theoretical mechanisms (e.g., role of schooling, labor markets, discrimination), or concrete case studies. Documents are non-relevant if they focus on unrelated meanings of “mobility” (physical movement, transport, or device/mobile technology), on online data disclosure or social-media features, or if they only mention “social mobility” in passing without substantive treatment. Edge cases include reports that use “Social Mobility” as an organizational/program name (which can be relevant if the report evaluates mobility outcomes) and papers that mention mobility briefly in broader studies — those require checking the abstract or methods to decide relevance.
