query_id	query	var_desc	var_narr
66195	environmental	A concise summary of public-opinion information about the environment: whether people feel they know more about environmental problems or solutions and want to learn more, whether they prioritize environmental protection versus economic competitiveness, and which sources or institutions (e.g., scientists, governments, media, companies, family, NGOs) they trust on environmental issues. The user is likely seeking or designing survey questions and/or analyzing public attitudes and trust related to environmental information and policy trade-offs.	A document is relevant to the keyword "environmental" if it contains substantive content about environmental topics — for example questions or text contrasting environmental problems vs solutions, attitudes toward environmental protection versus economic competitiveness, or which actors (scientists, governments, media, family, companies, NGOs) people trust on environmental issues. Short excerpts of survey items that explicitly ask “Do you know more about environmental problems or solutions?” or list trust options (scientists, newspapers, EU, companies, etc.) are clearly relevant because they address public knowledge, preferences and trust related to the environment. Documents are non‑relevant when they lack any environment-specific content (e.g., unrelated survey modules, generic metadata codes, or text about non‑environmental domains like health or education) or when the word “environmental” appears only as an attribute with no contextual meaning. Edge cases include code‑only records (e.g., Q48, Q45) which may be relevant if you can map the codes to survey questions, noisy/repeated transcriptions that are topically relevant but low quality, and ambiguous uses of “protection” or “problems” that refer to non‑environmental contexts.
6719	welfare	The user is looking for survey items and measures about "welfare," specifically public attitudes toward social welfare systems (coverage, cost, exemplar status, and expectations for 2030) and farm animal welfare (importance, definitions, and whether buying welfare-friendly products helps). They likely need concise question wording or a set of standardized survey questions capturing these topics.	A document is relevant to the query "welfare" when it substantively discusses welfare topics such as social welfare systems (coverage, cost, future outlook), animal welfare (farm animal protection, welfare-friendly products), or public attitudes and behaviors toward welfare policies. The pasted paragraph contains many survey items about national and community social welfare systems and questions about the importance of farm animal welfare and purchasing welfare‑friendly products, so those passages are clearly relevant. Documents that merely include the word "welfare" as a code fragment, in repeated metadata lines, or as a company/product name without substantive discussion are not relevant. Edge cases include narrowly focused documents — for example, a study only about consumer purchasing of welfare‑friendly products is highly relevant for animal‑welfare intent but less so for someone researching social welfare policy, and texts that use similar words (wellbeing, welfare check) may be ambiguous without context. To resolve ambiguity, prefer documents with full question text, explanatory context, or topic tags indicating "social policy" or "animal welfare."
67543	flüchtling	The user is looking for information about refugees ("Flüchtlinge") in Germany, particularly public attitudes and survey questions about integration, crime concerns, and whether refugees will be successfully integrated. They also want details on legal/status distinctions (refugee vs. Heimatvertriebener), political responses (e.g., CDU/CSU), and EU burden-sharing for migrants arriving in countries like Italy.	A document is relevant to the query "Flüchtling" if it substantively discusses refugees or displaced persons — for example news or analysis about refugees from North Africa arriving in Italy, EU rules on which country must take asylum seekers, German debates about integration, surveys asking “Wird es gelingen die Flüchtlinge bei uns…”, or questions about origin country, asylum policy, and crime perceptions. Short question texts, opinion-polls, legal texts about asylum responsibility, and reports on “Heimatvertriebene” (expellees/displaced persons) are also relevant because they address the same subject matter. Documents are non-relevant if they only contain the token “Flüchtling” as noise or duplication, are purely metadata or lists with no substantive content, or use similar words in a different sense (e.g., the adjective “flüchtig,” an animal fleeing, or a person’s surname). Edge cases include historical material on Heimatvertriebene (related but distinct from contemporary asylum issues), very short survey snippets or repeated keyword dumps (contain the term but offer little usable information), and documents in other languages — which can be relevant if they meaningfully discuss refugees but less useful if they lack context.
67689	family	Search for survey variables describing household and family characteristics—especially family income (country-specific measures and income quartiles), type of housing, and preferred gender roles/family type—across ISSP data for countries like Russia, Bulgaria and the Philippines. Also identify related variables on how you or a family member received clinical infection risk information (doctor, hospital staff, TV, internet, radio, brochures, NGOs, etc.).	A document is relevant to the keyword "family" when it explicitly concerns households or household members — for example, statements about family income (monthly income, income per family member, income quartiles), family type and roles (changing roles of husband and wife, which family model one prefers), or living arrangements described as "detached family house" or multi-family housing. Items that list survey questions or answers like "you or a member of your family received this information" or variables named RU_INC09 / BG_INC etc. are also highly relevant because they directly encode household-level information. A document is non-relevant when "family" appears only incidentally (e.g., in a company name, a biological "family" of viruses, or a single isolated token) or when only opaque technical codes are present without human-readable family content. Edge cases include records that mix relevant family labels with repetitive metadata or code lists: if readable labels or context (income amounts, role descriptions, housing types) are present the document should be considered relevant, but if it contains only numeric codes or duplicated lines with no explanatory text it may be borderline or require codebook lookup. Overall, the more distinct family-related fields and human-readable descriptions a document contains, the higher its relevance.
6854	natur	A concise survey information need: assess respondents’ beliefs about nature (e.g., whether “nature is sacred” and support for protecting the environment) and how important environmental goals are for societal development. Also map those answers to a coding scheme of political perception levels (01 ideologue through 09 no-issue-content, 99 not asked).	A document is relevant to the query "natur" when it explicitly addresses nature or environmental protection — for example texts that ask about "Schutz von Natur und Umwelt," survey items asking respondents to rate the importance of nature for societal development, or coding schemes that classify political attitudes toward environmental issues. Documents that include the survey scale, response options, or the listed variable codes (01–09) are especially pertinent because they show the content is about public attitudes and political perception of nature. Non-relevant documents merely containing the substring "natur" (e.g., in unrelated words like "international" or brand names) or using "natur" metaphorically without environmental meaning (e.g., "human nature" in a philosophical sense) should be deprioritized. Edge cases include texts in German versus English (German-language items such as "Schutz von Natur" are highly relevant), partial repeats or duplicated question blocks (which are relevant but signal redundancy), and documents that discuss economic or political decisions without any link to environmental consequences (which may be only tangentially relevant).
718	turkey	A search for survey questions and variable codes about public opinion in Turkey on EU accession — specifically whether people would favour Turkey joining the EU (once conditions are met), perceived obstacles (standards, democracy, human rights, economy, corruption, reconciliation, etc.), and related items like party attachment and regional identifiers. The query appears to target specific survey variables and datasets (ISSP/Eurobarometer, ZA/ v/Q codes) that record Turkish responses and regional breakdowns.	A document is relevant to the keyword "turkey" when it substantively discusses the country Turkey — for example public opinion about Turkey’s EU accession, survey items on favourability (QD15, Q37, Q58, etc.), party attachment in Turkey, or dataset notes (ISSP ZA4950/ZA7570) that report Turkish responses. Short lists of variable names or question codes that clearly refer to Turkish modules or to Turkey-specific questions are relevant because they signal content about Turkey’s membership prospects, reforms (human rights, democracy, standards), or regional treatment (Western Balkans and Turkey). A document is non-relevant when "turkey" refers to the bird, a recipe, a company name, or appears only incidentally (e.g., a long list of country names where Turkey is mentioned but not discussed), or when the main topic is unrelated despite containing a TR country code. Edge cases include texts that use alternative spellings (Türkiye), documents in another language that nevertheless focus on Turkey’s accession, or files that contain only raw dataset codes without question text — these may be borderline and should be judged by whether substantive Turkey-specific content (questions, responses, or analysis) is present.
729	trust	The user wants to measure how much trust people place in other nationalities (e.g., Russians, Americans, Luxembourgers, Belgians, British, Danes, Finns, Dutch, Spaniards, French, Greeks, Turks, Austrians) and in European institutions (European Parliament, Commission, Central Bank). They need a survey-style question asking respondents to indicate their level of trust on a four-point scale (a lot, some, not very much, no trust at all) and whether they tend to trust or tend not to trust those institutions/people.	A document is relevant to the query "trust" when it explicitly asks about or measures levels of trust — for example survey items that ask "How much trust do you have in the Russians/Americans?" or that list institutions like the European Parliament, European Commission, or European Central Bank and provide response options (a lot, some, not very much, none). Relevant examples include question codes and item text such as v25 Q7 TRUST IN RUSSIANS, qa10 1 EUROPEAN PARLIAMENT TRUST, or lists of trust-in-people items by nationality (British, Danes, Finns, etc.). Non-relevant documents are those that mention the word "trust" in unrelated senses (trust funds, legal trusts, idiomatic uses), or that only include a stray country name without any trust question or scale. Edge cases include noisy or duplicated transcripts where the core trust items are present among repeated text, translated or paraphrased surveys where the response scale is implicit, and documents that report aggregate “trust indices” (still relevant) versus documents that merely reference trustworthiness or reputation without measuring respondents’ trust (less relevant).
7422	psychische	Assess whether respondents were treated for a psychological or emotional problem in the past 12 months and capture repeated survey items about that treatment. Also determine whether respondents are exposed to work-related psychosocial stressors that negatively affect their wellbeing and whether their physical or mental health problems were caused or worsened by work (selecting the main reason where applicable).	A document is relevant if it contains the exact survey items or variable definitions asking whether someone was treated for a psychological or emotional problem in the last 12 months (e.g., W33201, x33201, y33201) or if it asks about exposure to work-related psychosocial stressors that negatively affect wellbeing (EF1050) or health problems caused or worsened by work in the past 12 months (EK0900P). Highly relevant examples are the full questionnaire or codebook showing the German question text, response options, timeframe (“letzten 12 Monate” / “vor der Berichtswoche”) and the variable codes. Non-relevant documents include general mental-health literature that does not ask about treatment or workplace causation, materials with a different timeframe (e.g., past 6 months), or unrelated occupational topics; simple metadata or summaries without the question wording are only partially useful. Edge cases include translations (English versions can be relevant if they clearly map back to the German items), items that mention “psychische Belastung” without linking to treatment or last-12-months timing (partially relevant), and duplicated strings of the same question (redundant but still relevant if content matches). Prefer sources that preserve both the exact wording and the variable/code context so you can unambiguously map responses to these survey items.
7445	psychische erkrankungen	User is looking for survey items and branching logic about mental health ("psychische Erkrankungen"), specifically questions on recent non‑chronic illness (were you sick in the last four weeks), whether the respondent received treatment for psychological problems in the past 12 months, exposure to work‑related psychosocial stressors that harm well‑being, and whether work caused or worsened physical or mental health. The query also requests the conditional display rules (Einblendung) that show these follow‑up questions when certain prior disease codes/fields (e.g., F095, hd01, hd13) are selected.	A document is relevant to the keyword "psychische erkrankungen" if it directly asks about or describes mental or psychological problems, their treatment, or work-related mental strain — for example the lines "Waren Sie während der letzten 12 Monate wegen eines psychischen oder seelischen Problems in Behandlung" and "Sind Sie bei Ihrer Arbeit psychisch belastenden Faktoren ausgesetzt" indicate clear relevance. The paragraph repeatedly asks about being sick in the last four weeks, treatment for psychological problems in the last 12 months, and whether work caused or worsened physical or mental health, so those items map tightly to the query. Edge cases include passages that only use generic terms like "Gesundheitsprobleme" or discuss chronic vs non-chronic illnesses without explicitly saying "psychisch" — these are borderline and may be partially relevant if context implies mental health. Non-relevant documents would focus exclusively on physical conditions, contain only administrative codes/variable names (hd16, V255) or routing logic without substantive mental-health content, or be in an unrelated language.
7488	psychische belastung	A concise summary of whether and how people experience psychological (seelische) burden — e.g., whether they received treatment for mental problems in the past 12 months, are exposed to work‑related psychological or physical stressors that harm their well‑being, and have health issues caused or worsened by work. It also covers related concerns about financial burdens (monthly loan payments, extra costs from health‑care reform) and who (young vs. old) will carry future financial strains.	A document is relevant to this query if it explicitly addresses "psychische Belastung" or equivalent survey items — for example, questions about being in treatment for a mental or emotional problem in the last 12 months, exposure to psychological stressors at work, or work-related health problems that are mental or psychosomatic in nature. Relevant documents also include survey instruments or reports that contain the exact question wording or variable codes (e.g., q033as, V199, V217) and analyses linking financial burdens (monthly interest/repayment) or policy changes (healthcare reform) to mental well‑being. Non‑relevant documents are those that mention “Belastung” only in a purely financial, legal, or physical context (e.g., mortgage interest or tax reform) without any connection to mental health, or texts that list variable names without corresponding question content. Borderline cases include papers on economic hardship or healthcare reform that discuss general burdens — these are relevant only if they explicitly analyze mental health outcomes or cite the same 12‑month / work‑related framing; translations, paraphrases, or duplicate survey copies that preserve the meaning should be treated as relevant.
79	environment	A concise description of survey items measuring public attitudes toward the environment, including personal willingness to protect it (e.g., paying higher prices or taxes, cutting standard of living), how important environmental protection is personally, perceived seriousness of various environmental problems (nuclear power, leaded fuel, industrial pollution, noise, etc.), opinions on public bodies’ effectiveness and preferred level of government involvement, and main sources of environmental information.	A document is relevant to the query "environment" if it explicitly addresses environmental topics such as attitudes toward protection, willingness to bear costs (taxes, higher prices, lower standard of living), perceived seriousness of specific problems (aircraft noise, industrial pollution, nuclear power), information sources about the environment, or levels of authority involvement. For example, survey items like "How willing to protect environment," "OVERALL IMPACT INDUSTRIAL AIR POLLUTION," and "Which are your three main sources of information about the environment" are clearly on-topic and indicate the document contains public-opinion or policy-related environmental content. Edge cases include items that only mention “environment” tangentially (e.g., a one-line reference in a broader economic report), brand names or metaphors using the word “environment,” or discussions of taxes that are unrelated to environmental protection; these would be less relevant. Also note that repeated labels, metadata, and year markers (1988, 1992) suggest a survey instrument or codebook—highly relevant for research into public attitudes but less so if the user seeks scientific measurements or ecological impact studies.
81	climate change	A request for who within the EU is seen as responsible for tackling climate change — i.e., which actors (national governments, the EU, regional/local authorities, businesses/industry, individuals, “all of them,” none, or others) people assign responsibility to. This likely reflects a survey question asking respondents to indicate which of those categories should tackle climate change.	This document is relevant because it explicitly contains repeated survey questions and coded responses about who within the EU is responsible for tackling climate change (answers including national governments, the European Union, businesses, regional/local authorities, individuals, “all of them,” “none,” and “don’t know”). A high-quality relevant document would provide clear, interpretable results or analysis (e.g., aggregated percentages, methodology, or commentary on public opinion across those categories). It would be less useful if it only contains raw, duplicated codes or transcription noise as here — still topically relevant but requiring cleaning and mapping of codes to meaningful labels. Edge cases include texts that mention “climate change” but discuss only scientific impacts (weather, ecosystems) without responsibility or policy, or documents about global responsibility frameworks that aren’t specific to the EU; those are partially relevant for context but not for the specific query about who within the EU is responsible.
8246	politisches engagement	The searcher wants to know whether political participation can achieve real change and how people view getting involved in politics—seeking public-opinion information on the effectiveness of engagement, support for specific state measures (e.g., taxation, job-creation), attitudes toward party directions and cooperation (CDU, SPD, Greens), EU development, and tolerance of political opponents.	A document is relevant to the keyword "politisches Engagement" when it explicitly addresses engagement in politics — for example questions or statements about whether people can achieve something through political engagement, descriptions of actions like voting, campaigning, joining parties, contacting representatives, protesting, or survey items asking about willingness to participate. The repeated survey item "GLAUBEN SIE DASS MAN DURCH ENGAGEMENT IN DER POLITIK ETWAS ERREICHEN KANN" is a clear positive signal, whereas lines about party positioning (e.g. "CDU politisch nach links entwickelt") are not relevant unless they are explicitly tied to mobilization or calls for participation. Watch out for false positives: phrases like "staatliches Engagement" (state intervention) or generic "Engagement" (volunteering for non-political causes) mention the word but do not concern civic/political participation. Edge cases include documents that only briefly mention engagement inside a long list of political items (partial relevance), or texts about political attitudes without any behavioral component (borderline relevant); relevance should be higher when the document contains concrete actions, efficacy evaluations, or repeated focused discussion of political engagement.
8382	politische werte	The user is looking for a summary of survey items measuring political values and engagement: which political actions people would take (e.g., voting, demonstrations, petitions, party work, traffic blockades), scales for willingness to act and perceived personal influence (e.g., 1–7 or 1–10), and general evaluations of political parties and government. They want a concise description of these questionnaire measures and response scales.	A document is relevant to the query "politische werte" if it addresses political values, attitudes or norms — for example survey items or scales that ask people to evaluate parties or the government, or that record willingness to take civic actions (voting, demonstrations, petitions, joining a party). The paragraph shown is clearly relevant: it lists response-coded items about political influence (V134–V144) and evaluative scales like "view government very bad — very good" and party ratings, which operationalize political values through attitudes and behavioral intentions. It would be non‑relevant if the text only uses the word "values" in an economic or appraisal sense, contains legal/administrative codes without attitudinal content, or is purely procedural (rules for protests) with no measure of personal or normative beliefs. Edge cases include questionnaire fragments that only show response scales or repeated instructions — these are borderline: they indicate a values survey (so relevant) but may lack enough context to interpret which political values are measured; similarly, translations or lists of variable codes without labels reduce usefulness. In short, prioritize documents that explicitly link opinions, norms or civic actions to evaluative scales or questions about the political system; exclude texts where "values" is unrelated or where only metadata appears.
8951	politische einstellungen	The user needs a survey question to capture respondents’ political orientation by self-placement on a left–right spectrum and to assess their attitudes toward people from various religious groups. They want concise question wording that asks respondents where they would place their own political views on a left–right scale and how they feel about different religious groups.	A document is relevant to the query "politische einstellungen" when it contains explicit material about political attitudes — for example German question wording or survey items that ask respondents to self-place on a left–right scale (terms like "links", "rechts", "Selbsteinstufung", "politische Einstellung"), scale labels or response options, and related attitudinal questions (such as feelings toward religious groups) that are used to measure political orientation. Concrete indicators of relevance include full question text, instructions for respondents, variable codes tied to survey items (e.g. pa01, po01, v54) and descriptions of the measurement instrument or coding scheme. A document is non-relevant if the words appear only as isolated metadata, repeated fragments with no substantive question text, unrelated uses of the same words (e.g. "politische" in a different topic), or if the content is corrupt/spammy and offers no usable survey content or conceptual discussion. Edge cases include codebooks or data dictionaries that only list variable names (which can be relevant if they link to question wording) and OCR'd/transcribed documents with heavy repetition — these may be borderline and require checking for the underlying question text or response categories to confirm relevance.
